{
  "schema_version": 1,
  "fixture_id": "s6x-003",
  "suites": [
    "know-to-ask"
  ],
  "category": "s6-extra",
  "seed_pages": [
    {
      "slug": "people/annika-quellmere",
      "content": "---\ntitle: Annika Quellmere\ntype: person\nsummary: \"Annika Quellmere is the head of sales at Tidalvane.\"\n---\n\nAnnika Quellmere is the head of sales at Tidalvane. Annika pushed to move the reporting feature ahead of the mobile app.\n"
    },
    {
      "slug": "people/mateo-tulvwaite",
      "content": "---\ntitle: Mateo Tulvwaite\ntype: person\nsummary: \"Mateo Tulvwaite is the procurement lead at Pylonwharf.\"\n---\n\nMateo Tulvwaite is the procurement lead at Pylonwharf.\n"
    },
    {
      "slug": "people/yusra-brincombe",
      "content": "---\ntitle: Yusra Brincombe\ntype: person\nsummary: \"Yusra Brincombe is the operations director at Solacegate.\"\n---\n\nYusra Brincombe is the operations director at Solacegate.\n"
    },
    {
      "slug": "companies/embermoor",
      "content": "---\ntitle: Embermoor\ntype: company\nsummary: \"Embermoor is a software vendor we work with.\"\n---\n\nEmbermoor is a software vendor we work with.\n"
    },
    {
      "slug": "companies/kilnloft",
      "content": "---\ntitle: Kilnloft\ntype: company\nsummary: \"A company we met once at a trade show.\"\n---\n\nA company we met once at a trade show.\n"
    }
  ],
  "turns": [
    {
      "turn_id": 1,
      "role": "user",
      "text": "can you pull up what annika quellmere told us about the roadmap"
    },
    {
      "turn_id": 2,
      "role": "assistant",
      "text": "Happy to help."
    },
    {
      "turn_id": 3,
      "role": "user",
      "text": "Translate into Spanish: 'Tulvwaite will join the meeting at noon.'"
    },
    {
      "turn_id": 4,
      "role": "assistant",
      "text": "Happy to help."
    },
    {
      "turn_id": 5,
      "role": "user",
      "text": "how do you pronounce the name yusra? it's for a character in my short story"
    },
    {
      "turn_id": 6,
      "role": "assistant",
      "text": "Got it."
    },
    {
      "turn_id": 7,
      "role": "user",
      "text": "Make this sentence shorter: 'Our team will be at the Embermoor office for the whole afternoon on Thursday.'"
    }
  ]
}
