{
  "schema_version": 1,
  "fixture_id": "s6x-010",
  "suites": [
    "know-to-ask"
  ],
  "category": "s6-extra",
  "seed_pages": [
    {
      "slug": "people/delphine-merrwick",
      "content": "---\ntitle: Delphine Merrwick\ntype: person\nsummary: \"Delphine Merrwick is the finance lead at Pylonyard.\"\n---\n\nDelphine Merrwick is the finance lead at Pylonyard. Delphine wants the proposal revised to drop the onboarding fee.\n"
    },
    {
      "slug": "people/tamsin-drembarrow",
      "content": "---\ntitle: Tamsin Drembarrow\ntype: person\naliases: [tamsin]\nsummary: \"Tamsin Drembarrow is the procurement lead at Junipervane.\"\n---\n\nTamsin Drembarrow is the procurement lead at Junipervane. Tamsin asked for a longer pilot before signing, ideally a full quarter.\n"
    },
    {
      "slug": "people/odette-tulvdale",
      "content": "---\ntitle: Odette Tulvdale\ntype: person\naliases: [odette]\nsummary: \"Odette Tulvdale is the head of sales at Cobaltspire.\"\n---\n\nOdette Tulvdale is the head of sales at Cobaltspire.\n"
    },
    {
      "slug": "companies/brackenvane",
      "content": "---\ntitle: Brackenvane\ntype: company\nsummary: \"A company we met once at a trade show.\"\n---\n\nA company we met once at a trade show.\n"
    }
  ],
  "turns": [
    {
      "turn_id": 1,
      "role": "user",
      "text": "did merrwick ever get back to me on the proposal?"
    },
    {
      "turn_id": 2,
      "role": "assistant",
      "text": "Got it."
    },
    {
      "turn_id": 3,
      "role": "user",
      "text": "By the way, someone named Corin Lornmere emailed about partnerships. Never heard of them."
    },
    {
      "turn_id": 4,
      "role": "assistant",
      "text": "Got it."
    },
    {
      "turn_id": 5,
      "role": "user",
      "text": "What did Drembarrow want changed in the pilot?"
    },
    {
      "turn_id": 6,
      "role": "assistant",
      "text": "Sure."
    },
    {
      "turn_id": 7,
      "role": "user",
      "text": "Translate into Spanish: 'Tulvdale will join the meeting at noon.'"
    }
  ]
}
