{
  "schema_version": 1,
  "fixture_id": "gen-kta-neg-002",
  "suites": [
    "know-to-ask"
  ],
  "category": "kta-neg",
  "seed_pages": [
    {
      "slug": "people/tobias-cindergate",
      "content": "---\ntitle: Tobias Cindergate\ntype: person\naliases: [tobias]\nsummary: Founder of Mosslight.\n---\n\nTobias Cindergate is the founder of Mosslight. Tobias shipped the v2 launch two weeks ahead of plan.\n"
    },
    {
      "slug": "companies/mosslight",
      "content": "---\ntitle: Mosslight\ntype: company\nsummary: Seed-stage company. Founded by Tobias Cindergate.\n---\n\nMosslight is a seed-stage company. Founded by Tobias Cindergate. The seed conversation started in 2025.\n"
    }
  ],
  "turns": [
    {
      "turn_id": 1,
      "role": "user",
      "text": "Monday already. Let me get coffee and then we start."
    },
    {
      "turn_id": 2,
      "role": "assistant",
      "text": "Sure."
    },
    {
      "turn_id": 3,
      "role": "user",
      "text": "By the way, someone named Priya Cobblewick emailed about partnerships. Never heard of them."
    }
  ]
}
